textId,speaker,text,TOXICITY,AFFINITY_EXPERIMENTAL,COMPASSION_EXPERIMENTAL,CURIOSITY_EXPERIMENTAL,NUANCE_EXPERIMENTAL,PERSONAL_STORY_EXPERIMENTAL,REASONING_EXPERIMENTAL,RESPECT_EXPERIMENTAL
216,TRUMP,"I’m the one that brought back football. By the way, I brought back Big Ten football. It was me and I’m very happy to do it-",0.019226074,0.88859653,0.49789,0.07947273,0.13755322,0.80994517,0.24630983,0.86541706
217,TRUMP,… and people of Ohio are very proud of me. And you know how I found out? When .,0.013885498,0.8511212,0.40077096,0.48220488,0.11220652,0.7876429,0.0624929,0.8163518
218,TRUMP,"I paid millions of dollars in taxes, millions of dollars of income tax. And let me just tell you, there was a story in one of the papers that paid-",0.01237757,0.77126855,0.5614327,0.1426516,0.20716603,0.8343515,0.2725482,0.7333364
219,BIDEN,Show us your tax returns.,0.012314741,0.3071033,0.094721004,0.36358526,0.062164437,0.25447714,0.03689402,0.5225227
220,TRUMP,"I paid $38 million one year, I paid $27 million one year.",0.008607753,0.49471286,0.17484002,0.08595042,0.15436298,0.7549243,0.099459566,0.5819706
221,BIDEN,Show us your tax returns.,0.012314741,0.3071033,0.094721004,0.36358526,0.062164437,0.25447714,0.03689402,0.5225227
222,TRUMP,"You’ll see it as soon as it’s finished, you’ll see it. You know, if you wanted to, go to the Board of Elections. There’s 118 page or so report that says everything I have, every bank I have, I’m totally under leveraged because the assets are extremely good, and I built a great company.",0.014953613,0.6765534,0.28050908,0.20949627,0.46600878,0.67815024,0.57578355,0.85190225
223,TRUMP,But let me tell you-,0.019854378,0.42076668,0.30014935,0.49640843,0.08111562,0.500175,0.034252916,0.618977
224,BIDEN,Release your tax return.,0.0109324735,0.2562081,0.17903334,0.42389053,0.08111562,0.3498539,0.079235196,0.548159
225,TRUMP,Let me-,0.022846194,0.5896652,0.36009043,0.5729101,0.15436298,0.5350778,0.065543100000000007,0.64254296
226,TRUMP,Millions of dollars.,0.01017851,0.18892528,0.3051104,0.24331647,0.19263089,0.24585372,0.0814101,0.5838763
227,TRUMP,"Millions of dollars, yes.",0.00804228,0.23565333,0.2230082,0.31414655,0.09045299,0.18186516,0.041384697,0.5537299
228,TRUMP,Millions of dollars. And you’ll get to see it. And you’ll get to see it.,0.020231359,0.26038522,0.31009308,0.091476426,0.07980745,0.11311338,0.061485674,0.55745804
229,BIDEN,When?,0.009298885,0.645146,0.37545913,0.774901,0.19263089,0.5241908,0.05456208,0.64254296
230,TRUMP,But let me just tell you-,0.020842785,0.4670914,0.26103324,0.45748383,0.06338342,0.5387309,0.027406916,0.60836554
231,BIDEN,In ?,0.00823077,0.53612226,0.20460455,0.66284686,0.14759369,0.4713463,0.045059014,0.57437617
232,TRUMP,"Chris, let me just say something, that it was the tax laws. I don’t want to pay tax. Before I came here, I was a private developer, I was a private business people. Like every other private person, unless they’re stupid, they go through the laws, and that’s what it is. He passed a tax bill that gave us all these privileges for depreciation and for tax credits. We built the building and we get tax credits, like the hotel on Pennsylvania Avenue. Which by the way, was given to me by the Obama Administration, if you can believe that. Now the man got fired right after that happened, but that’s-",0.42129645,0.7563304,0.39066955,0.5196182,0.7405501,0.8205134,0.64353657,0.6974527
233,BIDEN,"Yeah, I do want to respond. Look, the tax code that put him in a position that he pays less tax than on the money a school teacher makes is because of him… He says he’s smart because he can take advantage of the tax code. And he does take advantage of the tax code. That’s why I’m going to eliminate the Trump tax cuts. And I’m going to eliminate those tax cuts.",0.038519915,0.7347321,0.470526,0.35360754,0.3648401,0.6032589,0.32686538,0.60836554
234,TRUMP,That’s okay.,0.014953613,0.61555785,0.54409087,0.32067287,0.09593137,0.4274001,0.051662933,0.714869
235,BIDEN,And make sure that we invest in the people who in fact need the help. People out there need help.,0.011435116,0.669544,0.86417085,0.10421379,0.10361524,0.08856578,0.22058022,0.84391606
236,TRUMP,But why didn’t you do it over the last 25 years?,0.011120965,0.0785286,0.072964646,0.8393035,0.053807575,0.09685791,0.01609901,0.36811587
237,BIDEN,Because you weren’t president-,0.039226998,0.32069492,0.087692045,0.5196182,0.08243042,0.15146351,0.029091854,0.35827813
238,TRUMP,Why didn’t you do it over the last 25 years?,0.012566062,0.08842566,0.07462743,0.8197431,0.04916908,0.122462906,0.018450918,0.40223753
239,BIDEN,Because you weren’t president and screwing things up.,0.39987978,0.4809408,0.08499461,0.12273092,0.040185187,0.18186516,0.031652197,0.23940414
240,TRUMP,You were a Senator and -,0.013571346,0.7563304,0.4579505,0.674164,0.121110424,0.5759005,0.08250451,0.74415445
241,BIDEN,You’re the worst president America has ever had. Come on.,0.5140397,0.29854265,0.08499461,0.053341843,0.0060492377,0.08413648,4.3830788e-4,0.1288494
242,TRUMP,"Hey, Joe, let me just tell you, Joe. In 47 months, I’ve done more than you’ve done in 47 years, Joe. We’ve done things that you never even thought of doing.",0.09828771,0.8331391,0.4579505,0.08925207,0.09593137,0.6576112,0.10179639,0.7544747
243,TRUMP,"Including fixing the broken military that you gave me, including taking care of your debts.",0.063027434,0.41112322,0.56361395,0.09371912,0.14423282,0.500175,0.0914217,0.5049093
244,TRUMP,He has none.,0.01633588,0.25208217,0.17069851,0.27846095,0.14423282,0.34038833,0.043212753,0.5500138
245,BIDEN,"Well, just take a look at what is the analysis done by Wall Street firms, points out that my economic plan would create 7 million more jobs than his in four years, number one. And number two, it would create an additional $1 trillion in economic growth, because it would be about buying American. The federal government spends $600 billion a year on everything from ships, to steel, to buildings and the like. And under my proposal, we’re going to make sure that every penny of that has to be made by a company-",0.048842013,0.513052,0.48796526,0.14768031,0.76368946,0.49822178,0.81821704,0.78054404
246,BIDEN,"By the way, I’m going to eliminate a significant number of the taxes. I’m going to make the corporate tax 28%. It shouldn’t be 21%. You have 91 companies federal, I mean, the fortune 500, who don’t pay a single penny in tax making billions of dollars.",0.012440401,0.37760857,0.355006,0.33050102,0.40080667,0.4274001,0.5083415,0.40670285
247,TRUMP,"Why didn’t you do it before, when you were Vice-President with Obama?",0.014953613,0.32069492,0.092282765,0.8511527,0.07336327,0.122462906,0.039574955,0.4806
248,BIDEN,"Because you in fact passed that, that was your tax proposal.",0.008859074,0.42560056,0.094721004,0.72037137,0.09593137,0.08239954,0.079235196,0.6066054
249,TRUMP,I got it done. And you know what happened?,0.018974753,0.7440378,0.25140157,0.70460725,0.07083046,0.74999434,0.041384697,0.6379401
250,BIDEN,"Yeah, you got it done-",0.01847211,0.7787711,0.41350082,0.43605095,0.07721034,0.4668769,0.046923243,0.7619688
251,TRUMP,Our economy boomed like it’s never boomed before.,0.028974265,0.43502206,0.25620726,0.04593215,0.07980745,0.5152022,0.078154646,0.53343624
252,BIDEN,The economy-,0.01225191,0.42076668,0.24185418,0.47290605,0.24461357,0.3217009,0.0914217,0.6066054
253,BIDEN,Let me finish.,0.11140333,0.4855708,0.31996915,0.44215542,0.08375148,0.43605614,0.05070595,0.68789035
254,BIDEN,Not lower tax for the American people.,0.012566062,0.43502206,0.25140157,0.23699021,0.039089337,0.13517593,0.036009192,0.45454627
255,TRUMP,Excuse me.,0.01646154,0.6520952,0.39066955,0.68552077,0.12436983,0.53325564,0.061485674,0.72088635
256,TRUMP,"They had the slowest economic recovery since 1929. It was the slowest recovery. Also, they took over something that was down here. All you had to do is turn on the lights and you pick up a lot. But they had the slowest economic recovery since 1929, and let me tell you about the stock market. When the stock market goes up, that means jobs. It also means 401ks. If you got in, if you ever became president with your ideas, you want to terminate my taxes. I’ll tell you what, you’ll lose. Half of the companies that have poured in here will leave. And plenty of companies that are already here, they’ll leave for other places. They will leave and you will have a depression, the likes of which you’ve never seen.",0.11367676,0.59408754,0.5942055,0.15779574,0.5939429,0.5169943,0.59461869999999994,0.52614826
257,BIDEN,Look-,0.022021262,0.53612226,0.3651927,0.5473918,0.19263089,0.506055,0.08470667,0.68313
258,BIDEN,"… we inherited the worst recession, short of a depression in American history. I was asked to bring it back. We were able to have an economic recovery that created the jobs you’re talking about. We handed him a booming economy, he blew it.",0.112540044,0.7787711,0.43804434,0.24966244,0.35919192,0.6521894,0.4196116,0.775303
259,TRUMP,It wasn’t booming.,0.015142105,0.32069492,0.18324682,0.11476911,0.08111562,0.54976135,0.045988884,0.4806
260,BIDEN,He blew it.,0.1373533,0.5407564,0.29028806,0.17310864,0.09593137,0.4535681,0.05456208,0.6101279
261,TRUMP,It wasn’t booming. It was the weakest recovery since 1929.,0.024967449,0.090955414,0.14242034,0.050528422,0.17501675,0.35939986,0.16020581,0.31482786
262,TRUMP,When COVID came along.,0.024613906,0.5176529,0.3651927,0.41464335,0.065840356,0.67953056,0.031652197,0.5093774
263,BIDEN,"Yeah, because what he did, even before COVID, manufacturing went in the hole. Manufacturing went in a hole-",0.050078966,0.32539845,0.08233969,0.36692032,0.13093169,0.24157341,0.17298084,0.38804084
264,TRUMP,"Excuse me, Chris, wait.",0.009424546,0.49928698,0.2230082,0.651571,0.08641282,0.5387309,0.05070595,0.68789035
265,BIDEN,… number one. Number two-,0.013885498,0.40630993,0.17069851,0.22143239,0.08111562,0.49044213,0.0624929,0.65334845
266,TRUMP,Chris.,0.008419261,0.53612226,0.33486533,0.44827527,0.20350432,0.5241908,0.097141095,0.7293719
267,BIDEN,Number three.,0.012314741,0.391925,0.18747956,0.33050102,0.10361524,0.373742,0.060482763,0.64408094
268,TRUMP,"They said it would take… No, you’re on number two.",0.019477395,0.4395828,0.25140157,0.11831558,0.08507892,0.3217009,0.056517217,0.5857847
269,BIDEN,No.,0.010869644,0.4809408,0.26103324,0.46364117,0.09593137,0.4274001,0.042296432,0.63030756
270,TRUMP,"Chris, Chris. They said it would take-",0.015016444,0.4809408,0.26103324,0.38030803,0.10932987,0.6589702,0.08692732,0.65179896
271,BIDEN,This guy-,0.033806015,0.645146,0.33987126,0.47290605,0.121110424,0.5134133,0.053591017,0.6595649
272,TRUMP,"… a miracle to bring back manufacturing. I brought back 700,000 jobs. They brought back nothing. They gave up on manufacturing.",0.0201057,0.6198689,0.25620726,0.08485947,0.140886,0.7592215,0.251519,0.5705969
273,BIDEN,We did not.,0.009110395,0.5851888,0.275634,0.29787818,0.12764418,0.5296206,0.0686341,0.676808
274,TRUMP,… standard fare.,0.009801528,0.4717001,0.26587954,0.34367463,0.2219624,0.4447776,0.112459674,0.68948036
275,BIDEN,I’m the guy that brought back the automobile industry.,0.0131943645,0.58071846,0.10248567,0.16798511,0.051476303,0.5888021,0.04786215,0.63030756
276,TRUMP,He totally gave up on manufacturing.,0.03109552,0.19607584,0.08951421,0.1276825,0.075921565,0.40605384,0.037783217,0.5071406
277,BIDEN,"I was asked to bring back Chrysler and General Motors. We brought them back right here in the state of Ohio and Michigan. He blew it. They’re gone. He blew it. And in fact, they’re gone-",0.12520397,0.79636,0.3651927,0.16288075,0.17153801,0.77410537,0.18591215,0.7231486
278,TRUMP,Ohio had the best year it’s ever had last year. Michigan had the best year they’ve ever had.,0.011749268,0.43502206,0.115081154,0.056196563,0.15776905,0.4145413,0.18916914,0.6101279
279,BIDEN,That is not true.,0.012754552,0.29427427,0.21371089,0.5524739,0.10077741,0.1853292,0.052624613,0.679965
280,TRUMP,"Many car companies came in from Germany, from Japan, went to Michigan, went to Ohio and they didn’t come in with you. .",0.019351736,0.11892864,0.10091686,0.13764244,0.31132707,0.5169943,0.1810444,0.46750137
281,BIDEN,And so you take a look at what he’s actually done. He’s done very little. His trade deals are the same way. He talks about these great trade deals. He talks about the art of the deal. China’s perfected the art of the steal. We have a higher deficit with China now than we did before. We have the highest trade deficit-,0.11067997,0.18180253,0.23239003,0.31089067,0.51995474,0.31247786,0.4967541,0.45454627
282,TRUMP,China ate your lunch- .,0.09958932,0.4304413,0.3150431,0.50670505,0.115097,0.496272,0.052624613,0.6030863
283,BIDEN,… with Mexico.,0.028974265,0.37760857,0.25620726,0.26562017,0.2108423,0.45798835,0.0914217,0.6272686
284,TRUMP,"China ate your lunch, Joe. And no wonder your son goes in and, wha–, he takes out billions of dollars. He takes out billions of dollars to manage. He makes millions of dollars. And also, while we’re at it, why is it just out of curiosity, the mayor of Moscow’s wife gave your son three and a half million dollars?",0.07845957,0.17470887,0.275634,0.7304368,0.41027227,0.2808293,0.20229156,0.329258
285,BIDEN,That is not true.,0.012754552,0.29427427,0.21371089,0.5524739,0.10077741,0.1853292,0.052624613,0.679965
286,TRUMP,What did he do to deserve it? What did he do with Burisma-,0.028620722,0.08716968,0.08678792,0.86533284,0.0379996,0.089466736,0.03689402,0.08662953
287,BIDEN,None of that is true.,0.011749268,0.16059916,0.14640224,0.30439144,0.09795316,0.17157565,0.037783217,0.4893925
288,TRUMP,"… to deserve $183,000?",0.0069741644,0.084673434,0.20460455,0.71807504,0.07850564,0.13517593,0.029091854,0.33884993
289,BIDEN,None of that is true.,0.011749268,0.16059916,0.14640224,0.30439144,0.09795316,0.17157565,0.037783217,0.4893925
290,TRUMP,"Oh really, he didn’t get three and a half million?",0.017592486,0.10759918,0.093215436,0.734758,0.08507892,0.32634202,0.013022356,0.40223753
291,BIDEN,Is totally-,0.022964042,0.58071846,0.31009308,0.5952238,0.14759369,0.4535681,0.056517217,0.63488114
292,BIDEN,Totally discredited. Totally discredited. And by the way-,0.15656179,0.40630993,0.08588872,0.36692032,0.03691611,0.17157565,0.023271002,0.26727372
293,TRUMP,"Well wait, he didn’t get three and a half million dollars, Joe?",0.013508516,0.09478993,0.093215436,0.70169973,0.08243042,0.237314,0.02164699,0.44598937
294,BIDEN,Mr. Vice-,0.01218908,0.4809408,0.23711215,0.50412613,0.13423505,0.4447776,0.06759904,0.66424555
295,TRUMP,He got three and a half million dollars-,0.012754552,0.15358509,0.19600275,0.23068507,0.14759369,0.4274001,0.08032035,0.4871909
296,TRUMP,… dollars.,0.010304171,0.32539845,0.21371089,0.31414655,0.20716603,0.4145413,0.083603315,0.6172022
297,BIDEN,That is not true.,0.012754552,0.29427427,0.21371089,0.5524739,0.10077741,0.1853292,0.052624613,0.679965
298,TRUMP,"Oh, really?",0.013508516,0.5314953,0.2707453,0.73418164,0.10361524,0.4188109,0.02164699,0.6364095
299,TRUMP,It’s a fact.,0.007351146,0.24385335,0.20909274,0.055240378,0.06338342,0.31247786,0.036009192,0.5426158
300,BIDEN,It is not a fact.,0.012691722,0.09925278,0.09043232,0.11476911,0.08243042,0.0798312,0.045059014,0.51350933
301,BIDEN,It’s been totally discredited.,0.059232414,0.21934268,0.07462743,0.11476911,0.030539246,0.25447714,0.043212753,0.40670285
302,TRUMP,"Did Burisma pay him 183 thousand a month, with no experience in energy?",0.010681152,0.06549357,0.048771802,0.8220455,0.14423282,0.14489856,0.10771486,0.124902606
303,BIDEN,My son did nothing wrong at Burisma-,0.034041706,0.18892528,0.18324682,0.1859979,0.023366287,0.39763463,0.065543100000000007,0.34852296
304,TRUMP,I think he did.,0.015016444,0.7189549,0.3957108,0.43605095,0.13423505,0.5553158,0.065543100000000007,0.7916484
305,BIDEN,The only guy that. . .,0.019603057,0.53612226,0.275634,0.24966244,0.06832278,0.57957983,0.034252916,0.5857847
306,BIDEN,"He doesn’t want to let me answer, because he knows I have the truth. His position has been totally thoroughly discredited. . .",0.08320791,0.513052,0.3150431,0.6032636,0.121110424,0.5116272,0.09369614,0.52978563
307,TRUMP,By who?,0.008733413,0.5314953,0.21371089,0.8283385,0.13423505,0.33100215,0.03689402,0.5876961
308,BIDEN,And you can-,0.012691722,0.61555785,0.3957108,0.57913995,0.15436298,0.44916433,0.059484657,0.6595649
309,TRUMP,The media.,0.014450971,0.40150738,0.25140157,0.5144596,0.140886,0.24585372,0.0686341,0.5426158
310,BIDEN,"by everybody. Well, by the media, by our allies.",0.015330595,0.37760857,0.19600275,0.12273092,0.048024524,0.17157565,0.061485674,0.45454627
311,TRUMP,"By the media, because they refuse to talk about it-",0.02638162,0.27303895,0.08588872,0.25284275,0.04350852,0.09404765,0.04786215,0.14889477
312,BIDEN,By the World Bank-,0.013508516,0.26038522,0.14242034,0.37026033,0.07336327,0.37855807,0.057501856,0.3977894
313,TRUMP,… because they’re embarrassed.,0.29405528,0.363303,0.28538823,0.17310864,0.060951967,0.31707925,0.03338158,0.42020884
314,BIDEN,"By everyone, as discredited. And matter of fact Matter of fact-",0.038991302,0.16059916,0.18324682,0.29138586,0.05854601,0.14164105,0.041384697,0.51350933
315,BIDEN,Even the people who testified under oath-,0.014890783,0.3028177,0.15846217,0.6087872,0.115097,0.31247786,0.05456208,0.5705969
316,TRUMP,"So let me ask you this, Joe- .",0.009047564,0.2772712,0.10406223,0.7426914,0.07083046,0.28977618,0.03338158,0.63030756
317,BIDEN,Even the people under-,0.028620722,0.4624895,0.34489664,0.42996442,0.13755322,0.4145413,0.0497534,0.60836554
318,TRUMP,He got three and a half million dollars from Moscow.,0.015204934,0.084673434,0.10248567,0.29462904,0.11220652,0.30333814,0.07281966,0.44598937
319,BIDEN,"… testified, he testified under oath in his Administration said I did my job and I did it very well.",0.010743983,0.8646994,0.10744284,0.19174455,0.24843976,0.7542805,0.2849469,0.8694144
320,TRUMP,"Oh, really?",0.013508516,0.5314953,0.2707453,0.73418164,0.10361524,0.4188109,0.02164699,0.6364095
321,BIDEN,I did it honorably.,0.017592486,0.81405926,0.59853727,0.067021005,0.06832278,0.71569854,0.08581485,0.8515285
322,TRUMP,I’d like to know who they are.,0.017341165,0.76877266,0.37545913,0.57034683,0.057352178,0.50213134,0.05070595,0.72767663
323,BIDEN,"Well, I’ll give you the list of the people who-",0.019226074,0.47631672,0.20909274,0.3239431,0.039089337,0.49044213,0.0145520475,0.6048477
324,TRUMP,I’ll fire them.,0.33421695,0.61555785,0.24185418,0.09724766,0.041287098,0.39763463,0.024911938,0.5426158
325,BIDEN,"I’m sure that you’ve already fired most of them, because they did a good job.",0.063423134,0.7223736,0.24661607,0.14768031,0.05263899,0.3641711,0.046923243,0.5537299
326,TRUMP,Some people don’t do a good job.,0.10696511,0.39671242,0.44796285,0.22143239,0.10077741,0.20453171,0.07600712,0.67208445000000006
327,BIDEN,"Well, here’s the-",0.01859777,0.2815116,0.23711215,0.47290605,0.05263899,0.34038833,0.018450918,0.611894
328,BIDEN,"Well, it’s hard to get any word in with this clown. Excuse me, this person.",0.62702215,0.34428877,0.21371089,0.08925207,0.028460866,0.34038833,4.3830788e-4,0.24860854
329,TRUMP,"Hey, hey, let me just say, that",0.026028076,0.63716775,0.36009043,0.43605095,0.075921565,0.5152022,0.036009192,0.7333364
330,BIDEN,"No, no. Mr. President-",0.015016444,0.49928698,0.26103324,0.53978604,0.07850564,0.34511116,0.053591017,0.7356071
331,TRUMP,"Three and a half million, Joe.",0.008105109,0.3490304,0.24185418,0.46056077,0.117999926,0.43171954,0.065543100000000007,0.6136608
332,BIDEN,That is simply not true.,0.013885498,0.2562081,0.15040267,0.42085955,0.053807575,0.085893385,0.029091854,0.6066054
333,TRUMP,Why did he deserve three and a half million from Moscow?,0.027206551,0.08968788,0.08951421,0.8557432,0.08375148,0.16144137,0.020841356,0.329258
334,BIDEN,"Look, here’s the deal. We want to talk about families and ethics. I don’t want to do that. I mean, his family, we could talk about all night. His family’s already-",0.031684756,0.5762543,0.6050563,0.39292225,0.17501675,0.38824895,0.15703636,0.6736572
335,TRUMP,My family-,0.017089844,0.7347321,0.5121217,0.46672752,0.20350432,0.7169528,0.08032035,0.7038609
336,TRUMP,My family lost a fortune by coming down and helping us with government.,0.043399423,0.7875513,0.7277136,0.21247254,0.11220652,0.79721725,0.0914217,0.60115284
337,BIDEN,And that’s such a-,0.029445656,0.6520952,0.55925435,0.31089067,0.07336327,0.53143644,0.039574955,0.7504528
338,TRUMP,Every single one of them lost a fortune by coming down and helping us with government.,0.051563308,0.7347321,0.5657983,0.09036188,0.121110424,0.6097354,0.088044226,0.5207141
339,BIDEN,"This is not about my family or his family. It’s about your family, the American people.",0.045131154,0.7189549,0.7132138,0.06601366,0.050319668,0.27196422,0.04786215,0.6595649
340,TRUMP,And he got three and a half million dollars for nothing.,0.01608456,0.12580372,0.13845752,0.24331647,0.06832278,0.4274001,0.043212753,0.39307475
341,BIDEN,"That’s not true. It doesn’t want to talk about what you need. You, the American people. It’s about you. That’s what we’re talking about here.",0.045131154,0.7563304,0.65320426,0.25922137,0.15776905,0.13517593,0.070717715,0.52978563
342,BIDEN,He didn’t take that.,0.0137598375,0.3823731,0.25140157,0.3272204,0.121110424,0.49822178,0.059484657,0.63182990000000006
343,TRUMP,"Chris, can I be honest? It’s a very important question-",0.0143253105,0.5176529,0.3051104,0.7781505,0.09317882,0.5387309,0.0665686,0.7006543
344,BIDEN,Try to be honest.,0.03545588,0.387145,0.53335375,0.18341066,0.09455179,0.12878054,0.09369614,0.7395898
345,TRUMP,He stood up-,0.0665887,0.3728518,0.24185418,0.3272204,0.13423505,0.506055,0.0665686,0.63182990000000006
346,TRUMP,… and he threatened Ukraine-,0.25462922,0.2645952,0.14242034,0.3602536,0.09455179,0.25881764,0.04413355,0.4111868
347,TRUMP,… with a billion dollars-,0.009361716,0.13270746,0.17903334,0.31740737,0.13423505,0.26317918,0.059484657,0.4871909
348,BIDEN,That is absolutely not true.,0.016838523,0.387145,0.26103324,0.5271598,0.054982804,0.15477188,0.035128914,0.6548995
349,BIDEN,That’s a good point.,0.009110395,0.5673467,0.46045768,0.45441046,0.07336327,0.17157565,0.030794177,0.8548695
350,TRUMP,"Well, and him too.",0.01822079,0.5314953,0.37545913,0.31740737,0.07209374,0.30333814,0.041384697,0.7504528
351,TRUMP,"Well, that’s all right, but he does plenty.",0.01847211,0.20325422,0.25140157,0.11476911,0.09317882,0.12878054,0.032514658,0.73617536
352,TRUMP,He does plenty.,0.01822079,0.37760857,0.29028806,0.107718125,0.089099705,0.3689464,0.06759904,0.7464419
353,TRUMP,"Oh yeah, sure.",0.01633588,0.6198689,0.2707453,0.4269254,0.07209374,0.40183613,0.024089392,0.6456206
354,TRUMP,That’s true.,0.008544922,0.5983713,0.49291897,0.6198765,0.075921565,0.30333814,0.038676813,0.775303
355,BIDEN,"It’s about equity and equality. It’s about decency. It’s about the Constitution. And we have never walked away from trying to require, acquire equity for everyone, equality for the whole of America. But we’ve never accomplished it, but we’ve never walked away from it like he has done. It is true, the reason I got in the race is when those people. . . Close your eyes, remember what those people look like coming out of the fields, carrying torches, their veins bulging, spewing–just spewing anti-Semitic bile and accompanied by the Ku Klux Klan. A young woman got killed, and they asked the president what he thought. He said, “There were very fine people on both sides.” No president’s ever said anything like that. .",0.23235008,0.8153271,0.83351815,0.38675448,0.6665392,0.61233866,0.54347324,0.758506
356,BIDEN,Now-,0.014827953,0.65557843,0.39066955,0.6450139,0.19985782,0.5571731,0.070717715,0.6815467
357,BIDEN,"… second point I’d make to you, is that when Floyd was killed, when Mr. Floyd was killed, there was a peaceful protest in front of the White House. What did he do? He came out of his bunker, had the military use tear gas on them so he could walk across to a church and hold up a Bible. And then what happened after that? The Bishop of that very church said that it was a disgrace. The general who was with him said “All he ever wants to do is divide people, not unite people at all.” This is a president who has used everything as a dog whistle, to try to generate racist hatred, racist division. This is a man who, in fact, you talk about helping African-Americans, one in 1000 African Americans has been killed because of the coronavirus. And if he doesn’t do something quickly, by the end of the year, one in 500 will have been killed. One in 500 African Americans. This man, this man is a savior of African-Americans? This man cares at all? This man’s done virtually nothing. Look, the fact is that you have to look at what he’s talks about. You have to look at what he did. And what he did has been disastrous for the African-American community.",0.26293078,0.21934268,0.86068326,0.34367463,0.79285264,0.10088148,0.6152004,0.15705985
358,TRUMP,So-,0.013697007,0.5038683,0.3499417,0.50670505,0.14423282,0.4668769,0.052624613,0.679965
359,TRUMP,"You did a crime bill, 1994, where you called them super-predators. African-Americans are super-predators and they’ve never forgotten it. They’ve never forgotten it.",0.46716887,0.5762543,0.63119733,0.54993176,0.31313094,0.14164105,0.36561543,0.4871909
360,BIDEN,I’ve never said-,0.016210219,0.68710047,0.20909274,0.25602922,0.07083046,0.7342236,0.043212753,0.6379401
